{
  "feasibility": {
    "stable": true,
    "gamma_ok": true,
    "b_ok": true,
    "dens_ok": true,
    "gamma_stats": {
      "gamma_min": 100.0,
      "gamma_max": 180.0,
      "gamma_mean": 145.0,
      "gamma_variance": 625.0,
      "dt": 0.002
    },
    "b_stats": {
      "b_mean_T": 5.0,
      "b_rms_fraction": 0.0
    },
    "density_stats": {
      "ne_max_cm3": 1e+20
    },
    "antiproton_yield_pass": true,
    "antiproton_yield_value": 177827941.00389227,
    "bennett_ok": true,
    "fom": 4.445698525097307e-21,
    "timestamp": "2025-08-19T03:38:12.785088+00:00",
    "scenario_id": null
  },
  "run_report": {
    "feasibility": {
      "stable": true,
      "gamma_ok": true,
      "b_ok": true,
      "dens_ok": true,
      "gamma_stats": {
        "gamma_min": 100.0,
        "gamma_max": 180.0,
        "gamma_mean": 145.0,
        "gamma_variance": 625.0,
        "dt": 0.002
      },
      "b_stats": {
        "b_mean_T": 5.0,
        "b_rms_fraction": 0.0
      },
      "density_stats": {
        "ne_max_cm3": 1e+20
      },
      "antiproton_yield_pass": true,
      "antiproton_yield_value": 177827941.00389227,
      "bennett_ok": true,
      "fom": 4.445698525097307e-21,
      "timestamp": "2025-08-19T03:38:12.785088+00:00",
      "scenario_id": null
    },
    "timeline_summary": {
      "path": "timeline.ndjson",
      "counts": {
        "run_started": 8,
        "vortex_stabilized": 8,
        "confinement_achieved": 8,
        "b_field_check": 37,
        "stability_check": 8,
        "step": 65,
        "fom_calculated": 8,
        "production_metrics": 8,
        "production_failure": 8,
        "fom_edge_check": 8
      },
      "first_ts": "2025-08-17T19:57:47.829417+00:00",
      "last_ts": "2025-08-19T04:01:07.177484+00:00",
      "wmax_min": 0.999992,
      "wmax_max": 0.999996,
      "perf_percentiles": {
        "p50": 0.00037504300053115003,
        "p90": 0.0009142820017586928,
        "p99": 0.001886884005216416
      },
      "perf_count": 65,
      "perf_ns_percentiles": {
        "p50": 375082,
        "p90": 914428,
        "p99": 1887311
      },
      "perf_ns_count": 65
    },
    "channel_report": {
      "error": "missing: channel_report.json"
    },
    "gate_summary_md": "missing: gate_summary.md"
  },
  "uq": {
    "n_samples": 50,
    "means": {
      "score": 1.3362304346917293
    },
    "results": [
      {
        "score": 0.19191387522452097
      },
      {
        "score": 0.9221837622792357
      },
      {
        "score": 1.8405514220057118
      },
      {
        "score": 1.4046017785775335
      },
      {
        "score": 1.8638356345807072
      },
      {
        "score": 1.0082297088475063
      },
      {
        "score": 0.4919972586144451
      },
      {
        "score": 0.9601650865808596
      },
      {
        "score": 1.2650758904351633
      },
      {
        "score": 1.0792396557786703
      },
      {
        "score": 1.9035618659474929
      },
      {
        "score": 1.0744219732218037
      },
      {
        "score": 0.9536224977242992
      },
      {
        "score": 1.4121378766234176
      },
      {
        "score": 2.4444700358702525
      },
      {
        "score": 1.4884209076039623
      },
      {
        "score": 1.022627467522776
      },
      {
        "score": 1.863488428966638
      },
      {
        "score": 1.0287644558998754
      },
      {
        "score": 2.0513103136919124
      },
      {
        "score": 2.008027701627511
      },
      {
        "score": 2.2234138326832644
      },
      {
        "score": 1.640743162190275
      },
      {
        "score": 0.7808845703860685
      },
      {
        "score": 1.6898112596327852
      },
      {
        "score": 2.5540262807318914
      },
      {
        "score": 1.4862752024730668
      },
      {
        "score": 1.065025612654715
      },
      {
        "score": 0.6033486264488268
      },
      {
        "score": 1.482443128330897
      },
      {
        "score": 0.466281034082229
      },
      {
        "score": 1.2694641547141987
      },
      {
        "score": 0.9329571306766865
      },
      {
        "score": 1.7876583324827706
      },
      {
        "score": 2.45710739051666
      },
      {
        "score": 2.947645371807713
      },
      {
        "score": 1.4933546035346508
      },
      {
        "score": 1.1452126958601982
      },
      {
        "score": 2.428415465737508
      },
      {
        "score": 1.547430172061504
      },
      {
        "score": 0.46263217131562084
      },
      {
        "score": 0.8647722250427612
      },
      {
        "score": 0.9781282882661569
      },
      {
        "score": 0.9493354679517098
      },
      {
        "score": 0.4802789965845128
      },
      {
        "score": 0.6107781236118857
      },
      {
        "score": 0.5529234481523031
      },
      {
        "score": 0.8411739001293399
      },
      {
        "score": 1.7937627090568222
      },
      {
        "score": 0.9975907798451432
      }
    ]
  },
  "uq_production": {
    "_missing": true,
    "path": "uq_production.json"
  },
  "sweeps": {
    "time": {
      "path": "data/full_sweep_with_time.csv",
      "rows": [
        {
          "n_e": "1e+19",
          "T_e": "5.0",
          "B": "4.5",
          "xi": "1.0",
          "alpha": "0.0",
          "t": "0.01",
          "ripple": "0.01",
          "yield": "3e+19",
          "E_total": "10000.0",
          "fom": "30000000.0",
          "eta": "False"
        },
        {
          "n_e": "1e+19",
          "T_e": "5.0",
          "B": "4.5",
          "xi": "1.0",
          "alpha": "0.0",
          "t": "0.1",
          "ripple": "0.01",
          "yield": "3e+19",
          "E_total": "100000.0",
          "fom": "3000000.0",
          "eta": "False"
        },
        {
          "n_e": "1e+19",
          "T_e": "5.0",
          "B": "4.5",
          "xi": "1.0",
          "alpha": "0.0",
          "t": "1.0",
          "ripple": "0.01",
          "yield": "3e+19",
          "E_total": "1000000.0",
          "fom": "300000.0",
          "eta": "False"
        },
        {
          "n_e": "1e+19",
          "T_e": "5.0",
          "B": "4.5",
          "xi": "1.0",
          "alpha": "0.01",
          "t": "0.01",
          "ripple": "0.009999000000000001",
          "yield": "3e+19",
          "E_total": "10000.0",
          "fom": "30000000.0",
          "eta": "False"
        },
        {
          "n_e": "1e+19",
          "T_e": "5.0",
          "B": "4.5",
          "xi": "1.0",
          "alpha": "0.01",
          "t": "0.1",
          "ripple": "0.00999",
          "yield": "3e+19",
          "E_total": "100000.0",
          "fom": "3000000.0",
          "eta": "False"
        },
        {
          "n_e": "1e+19",
          "T_e": "5.0",
          "B": "4.5",
          "xi": "1.0",
          "alpha": "0.01",
          "t": "1.0",
          "ripple": "0.0099",
          "yield": "3e+19",
          "E_total": "1000000.0",
          "fom": "300000.0",
          "eta": "False"
        },
        {
          "n_e": "1e+19",
          "T_e": "5.0",
          "B": "4.5",
          "xi": "2.0",
          "alpha": "0.0",
          "t": "0.01",
          "ripple": "0.01",
          "yield": "3e+19",
          "E_total": "10000.0",
          "fom": "30000000.0",
          "eta": "False"
        },
        {
          "n_e": "1e+19",
          "T_e": "5.0",
          "B": "4.5",
          "xi": "2.0",
          "alpha": "0.0",
          "t": "0.1",
          "ripple": "0.01",
          "yield": "3e+19",
          "E_total": "100000.0",
          "fom": "3000000.0",
          "eta": "False"
        },
        {
          "n_e": "1e+19",
          "T_e": "5.0",
          "B": "4.5",
          "xi": "2.0",
          "alpha": "0.0",
          "t": "1.0",
          "ripple": "0.01",
          "yield": "3e+19",
          "E_total": "1000000.0",
          "fom": "300000.0",
          "eta": "False"
        },
        {
          "n_e": "1e+19",
          "T_e": "5.0",
          "B": "4.5",
          "xi": "2.0",
          "alpha": "0.01",
          "t": "0.01",
          "ripple": "0.009999000000000001",
          "yield": "3e+19",
          "E_total": "10000.0",
          "fom": "30000000.0",
          "eta": "False"
        },
        {
          "n_e": "1e+19",
          "T_e": "5.0",
          "B": "4.5",
          "xi": "2.0",
          "alpha": "0.01",
          "t": "0.1",
          "ripple": "0.00999",
          "yield": "3e+19",
          "E_total": "100000.0",
          "fom": "3000000.0",
          "eta": "False"
        },
        {
          "n_e": "1e+19",
          "T_e": "5.0",
          "B": "4.5",
          "xi": "2.0",
          "alpha": "0.01",
          "t": "1.0",
          "ripple": "0.0099",
          "yield": "3e+19",
          "E_total": "1000000.0",
          "fom": "300000.0",
          "eta": "False"
        },
        {
          "n_e": "1e+19",
          "T_e": "5.0",
          "B": "4.5",
          "xi": "4.0",
          "alpha": "0.0",
          "t": "0.01",
          "ripple": "0.01",
          "yield": "3e+19",
          "E_total": "10000.0",
          "fom": "30000000.0",
          "eta": "False"
        },
        {
          "n_e": "1e+19",
          "T_e": "5.0",
          "B": "4.5",
          "xi": "4.0",
          "alpha": "0.0",
          "t": "0.1",
          "ripple": "0.01",
          "yield": "3e+19",
          "E_total": "100000.0",
          "fom": "3000000.0",
          "eta": "False"
        },
        {
          "n_e": "1e+19",
          "T_e": "5.0",
          "B": "4.5",
          "xi": "4.0",
          "alpha": "0.0",
          "t": "1.0",
          "ripple": "0.01",
          "yield": "3e+19",
          "E_total": "1000000.0",
          "fom": "300000.0",
          "eta": "False"
        },
        {
          "n_e": "1e+19",
          "T_e": "5.0",
          "B": "4.5",
          "xi": "4.0",